Code,Name,Attendance,Seen_in_4hrs,Admissions
RYG,Coventry And Warwickshire Partnership NHS Trust,0,N/A,0
Y02613,Coventry NHS Healthcare Ctr,1310,N/A,0
RLT,George Eliot Hospital NHS Trust,1324,95.90%,250
RJC,South Warwickshire NHS Foundation Trust,1277,97.70%,333
RKB,University Hospitals Coventry And Warwickshire NHS Trust,3666,91.70%,912
RWP,Worcestershire Acute Hospitals NHS Trust,2871,94.50%,651
R1A,Worcestershire Health And Care NHS Trust,716,N/A,0
RLQ,Wye Valley NHS Trust,1078,90.40%,257
NTYH1,Assura Minerva Llp,571,N/A,0
Y00058,Carfax Health Enterprise,627,N/A,0
R1J,Gloucestershire Care Services NHS Trust,1309,N/A,0
RTE,Gloucestershire Hospitals NHS Foundation Trust,2341,93.60%,713
RN3,Great Western Hospitals NHS Foundation Trust,2327,93.60%,388
RD1,Royal United Hospital Bath NHS Trust,1399,92.40%,477
RNZ,Salisbury NHS Foundation Trust,834,93.90%,202
NLY,Seqol,276,N/A,0
NLX,Sirona Care & Health,146,N/A,0
AAH,Tetbury Hospital Trust Ltd,64,N/A,0
NL7,Assura Vertis Urgent Care Centres (Birmingham),1395,N/A,0
Y03432,Badger Walsall Ooh,192,N/A,0
RQ3,Birmingham Children's Hospital NHS Foundation Trust,1161,96.90%,234
RYW,Birmingham Community Healthcare NHS Trust,180,N/A,0
M85813,Birmingham Wic,680,N/A,0
RLU,Birmingham Women's NHS Foundation Trust,0,N/A,0
Y02737,Dudley Borough Walk In Centre,1021,N/A,0
NTPAL,Greet General Practice & Urgent Care Centre,512,N/A,0
RR1,Heart Of England NHS Foundation Trust,4799,88.90%,"1,596"
RXK,Sandwell And West Birmingham Hospitals NHS Trust,4921,89.30%,785
Y02736,Showell Park Health & Walk In Centre,518,N/A,0
Y02568,Solihull Healthcare & Walk-In-Centre,1127,N/A,0
Y02615,South Birmingham GP Walk In Centre,1070,N/A,0
Y02961,Summerfield GP Surg & Urgent Care Centre,894,N/A,0
RNA,The Dudley Group NHS Foundation Trust,1952,89.30%,507
RL4,The Royal Wolverhampton NHS Trust,2987,93.50%,442
RRK,University Hospitals Birmingham NHS Foundation Trust,1985,97.00%,522
RBK,Walsall Healthcare NHS Trust,2087,90.30%,401
Y02628,Walsall Walk In Health Centre,1222,N/A,0
NLW,Bristol Community Health,1213,N/A,0
RVJ,North Bristol NHS Trust,2104,84.50%,517
NLT,North Somerset Community Partnership Community Interest Company,152,N/A,0
RH5,Somerset Partnership NHS Foundation Trust,1549,N/A,0
RBA,Taunton And Somerset NHS Foundation Trust,1073,96.90%,322
RA7,University Hospitals Bristol NHS Foundation Trust,2246,86.70%,568
RA3,Weston Area Health NHS Trust,1094,97.50%,271
RA4,Yeovil District Hospital NHS Foundation Trust,930,96.80%,269
RTV,5 Boroughs Partnership NHS Foundation Trust,996,N/A,0
RJR,Countess Of Chester Hospital NHS Foundation Trust,1652,94.80%,349
RJN,East Cheshire NHS Trust,1036,96.70%,226
RBT,Mid Cheshire Hospitals NHS Foundation Trust,1662,92.50%,218
RWW,Warrington And Halton Hospitals NHS Foundation Trust,1966,96.60%,413
RY7,Wirral Community NHS Trust,985,N/A,0
RBL,Wirral University Teaching Hospital NHS Foundation Trust,2451,81.30%,597
RLN,City Hospitals Sunderland NHS Foundation Trust,2535,93.30%,600
RNN,Cumbria Partnership NHS Foundation Trust,814,N/A,0
Y02647,Encompass GP Practice 2,602,N/A,0
RR7,Gateshead Health NHS Foundation Trust,1371,96.70%,359
RNL,North Cumbria University Hospitals NHS Trust,1509,97.20%,372
RTF,Northumbria Healthcare NHS Foundation Trust,3240,97.30%,863
RE9,South Tyneside NHS Foundation Trust,3546,93.90%,259
RTD,The Newcastle Upon Tyne Hospitals NHS Foundation Trust,3814,95.80%,510
RTX,University Hospitals Of Morecambe Bay NHS Foundation Trust,2119,93.30%,489
RFS,Chesterfield Royal Hospital NHS Foundation Trust,1383,98.10%,383
RTG,Derby Hospitals NHS Foundation Trust,3304,95.00%,720
Y02442,Derby Open Access Centre,706,N/A,0
RY8,Derbyshire Community Health Services NHS Trust,911,N/A,0
NNJ,Derbyshire Health United Ltd,360,N/A,0
NLV02,NHS Nottingham City 8Am - 8Pm Health Centre,850,N/A,0
NR3,Nottingham Citycare Partnership,1233,N/A,0
RX1,Nottingham University Hospitals NHS Trust,3840,88.40%,823
RK5,Sherwood Forest Hospitals NHS Foundation Trust,2757,94.90%,525
Y02596,Cardrew Health Centre,471,N/A,0
RBZ,Northern Devon Healthcare NHS Trust,2436,89.50%,282
NLL,Peninsula Community Health C.I.C,1499,N/A,0
NR5,Plymouth Community Healthcare (Cic),480,N/A,0
RK9,Plymouth Hospitals NHS Trust,1779,97.00%,486
REF,Royal Cornwall Hospitals NHS Trust,1346,81.60%,443
RH8,Royal Devon And Exeter NHS Foundation Trust,1981,93.90%,555
RA9,South Devon Healthcare NHS Foundation Trust,1473,94.40%,473
R1G,Torbay And Southern Devon Health And Care NHS Trust,850,N/A,0
RXP,County Durham And Darlington NHS Foundation Trust,5752,90.90%,780
RVW,North Tees And Hartlepool NHS Foundation Trust,1751,97.20%,281
RTR,South Tees Hospitals NHS Foundation Trust,3961,96.40%,546
RGT,Cambridge University Hospitals NHS Foundation Trust,2189,93.20%,695
RYV,Cambridgeshire Community Services NHS Trust,731,N/A,0
NAX,East Coast Community Healthcare C.I.C,95,N/A,0
Y02662,Greyfriars Health Centre,210,N/A,0
RQQ,Hinchingbrooke Health Care NHS Trust,818,92.90%,188
RGQ,Ipswich Hospital NHS Trust,1576,97.90%,430
RGP,James Paget University Hospitals NHS Foundation Trust,1391,94.40%,257
RM1,Norfolk And Norwich University Hospitals NHS Foundation Trust,2199,95.60%,614
NMH01,Norwich Practices Ltd (Castle Mall),1312,N/A,0
RGN,Peterborough And Stamford Hospitals NHS Foundation Trust,1873,80.20%,503
NHM,Suffolk Community Healthcare,112,N/A,0
RCX,"The Queen Elizabeth Hospital, King's Lynn, NHS Foundation Trust",1083,95.60%,348
RGR,West Suffolk NHS Foundation Trust,1192,96.10%,348
NQ1,Anglian Community Enterprise Community Interest Company (Ace Cic),515,N/A,0
NWK,Assura Chelmsford Llp,710,N/A,0
RDD,Basildon And Thurrock University Hospitals NHS Foundation Trust,2419,93.40%,477
RDE,Colchester Hospital University NHS Foundation Trust,1574,94.20%,438
RQ8,Mid Essex Hospital Services NHS Trust,1701,90.60%,404
Y02646,North Colchester Healthcare Centre,1137,N/A,0
RAJ,Southend University Hospital NHS Foundation Trust,1753,85.90%,500
RQW,The Princess Alexandra Hospital NHS Trust,2156,87.40%,500
RMC,Bolton NHS Foundation Trust,2277,94.20%,507
RY2,Bridgewater Community Healthcare NHS Trust,2622,N/A,0
RW3,Central Manchester University Hospitals NHS Foundation Trust,5780,92.10%,824
Y02875,Lindley House Health Centre,1065,N/A,0
RW6,Pennine Acute Hospitals NHS Trust,5968,95.80%,"1,226"
RT2,Pennine Care NHS Foundation Trust,1598,N/A,0
RM3,Salford Royal NHS Foundation Trust,1877,95.20%,588
RWJ,Stockport NHS Foundation Trust,1785,93.00%,565
RMP,Tameside Hospital NHS Foundation Trust,1659,92.30%,456
RBV,The Christie NHS Foundation Trust,0,N/A,0
RM2,University Hospital Of South Manchester NHS Foundation Trust,1886,96.20%,596
RRF,"Wrightington, Wigan And Leigh NHS Foundation Trust",1765,93.80%,497
NWJ,Assura Lea Valley Llp,363,N/A,0
RC1,Bedford Hospital NHS Trust,1300,88.60%,304
Y03571,Corby Urgent Care Centre,1368,N/A,0
RWH,East And North Hertfordshire NHS Trust,2563,92.00%,628
RY4,Hertfordshire Community NHS Trust,144,N/A,0
RNQ,Kettering General Hospital NHS Foundation Trust,1478,95.40%,395
RC9,Luton And Dunstable University Hospital NHS Foundation Trust,2445,98.30%,526
RD8,Milton Keynes Hospital NHS Foundation Trust,2772,84.60%,287
RNS,Northampton General Hospital NHS Trust,2165,88.70%,514
Y02428,Putnoe Medical Centre Walk In Centre,405,N/A,0
RWG,West Hertfordshire Hospitals NHS Trust,2592,91.30%,558
RN7,Dartford And Gravesham NHS Trust,1988,96.20%,585
G82071,Dr Jm Ribchester & Partners,400,N/A,0
RVV,East Kent Hospitals University NHS Foundation Trust,4027,91.00%,785
RYY,Kent Community Health NHS Trust,2396,N/A,0
RWF,Maidstone And Tunbridge Wells NHS Trust,2531,92.20%,658
RPA,Medway NHS Foundation Trust,1755,96.00%,235
RXL,Blackpool Teaching Hospitals NHS Foundation Trust,1901,83.80%,433
RXR,East Lancashire Hospitals NHS Trust,3624,87.30%,758
RXN,Lancashire Teaching Hospitals NHS Foundation Trust,2441,96.10%,419
C82038,Latham House Medical Practice,140,N/A,0
RY5,Lincolnshire Community Health Services NHS Trust,3050,N/A,0
NJS05,Loughborough Urgent Care Centre,936,N/A,0
C82009,Market Harborough Med.Ctr,288,N/A,0
C82010,Oakham Medical Practice,82,N/A,0
RWD,United Lincolnshire Hospitals NHS Trust,3017,94.20%,727
RWE,University Hospitals Of Leicester NHS Trust,4231,80.60%,723
RF4,"Barking, Havering And Redbridge University Hospitals NHS Trust",4980,85.90%,969
RVL,Barnet And Chase Farm Hospitals NHS Trust,2796,81.70%,381
R1H,Barts Health NHS Trust,8652,93.60%,"1,698"
NTPAH,Broad Street Medical Practice & Walk In Centre,501,N/A,0
NQV,Bromley Healthcare,566,N/A,0
RYX,Central London Community Healthcare NHS Trust,4461,N/A,0
RQM,Chelsea And Westminster Hospital NHS Foundation Trust,2300,98.10%,341
RJ6,Croydon Health Services NHS Trust,2743,92.20%,600
Y02823,Dmc Vicarage Lane,633,N/A,0
RC3,Ealing Hospital NHS Trust,2145,96.60%,417
NX122,Edridge Road Community Health Centre,787,N/A,0
RVR,Epsom And St Helier University Hospitals NHS Trust,3001,97.60%,663
RJ1,Guy's And St Thomas' NHS Foundation Trust,3464,95.50%,642
Y03082,Harold Wood Walk In Centre,1066,N/A,0
RQX,Homerton University Hospital NHS Foundation Trust,2340,96.40%,312
RY9,Hounslow And Richmond Community Healthcare NHS Trust,931,N/A,0
G85715,Hurley Group Practice,542,N/A,0
RYJ,Imperial College Healthcare NHS Trust,5515,92.20%,929
RJZ,King's College Hospital NHS Foundation Trust,5703,81.60%,952
RAX,Kingston Hospital NHS Foundation Trust,2209,94.10%,335
RJ2,Lewisham And Greenwich NHS Trust,5450,87.20%,936
RP6,Moorfields Eye Hospital NHS Foundation Trust,1816,N/A,0
RAT,North East London NHS Foundation Trust,1157,N/A,0
RAP,North Middlesex University Hospital NHS Trust,3577,92.50%,621
RV8,North West London Hospitals NHS Trust,4317,90.70%,776
Y02973,Orchard Village Walk-In-Centre,150,N/A,0
Y02585,Orient Practice,250,N/A,0
RPG,Oxleas NHS Foundation Trust,914,N/A,0
RT3,Royal Brompton & Harefield NHS Foundation Trust,0,N/A,0
RAL,Royal Free London NHS Foundation Trust,1840,97.00%,318
RAN,Royal National Orthopaedic Hospital NHS Trust,0,N/A,0
Y03047,St Andrews Walk-In Centre,449,N/A,0
RJ7,St George's Healthcare NHS Trust,2945,93.50%,851
F84747,The Barkantine Practice,531,N/A,0
RAS,The Hillingdon Hospitals NHS Foundation Trust,2972,92.70%,461
Y02987,The Practice Loxford,309,N/A,0
E84068,The Ridgeway Surgery,191,N/A,0
RKE,The Whittington Hospital NHS Trust,1975,95.70%,391
NTPAK,Tollgate Lodge Medical Centre,118,N/A,0
RRV,University College London Hospitals NHS Foundation Trust,2587,96.90%,281
NDA,Virgin Care Services Ltd,1386,N/A,0
Y03201,Waldron - Hurley Unregistered Practice,599,N/A,0
RFW,West Middlesex University Hospital NHS Trust,2791,93.50%,415
REM,Aintree University Hospital NHS Foundation Trust,2084,95.00%,399
RBS,Alder Hey Children's NHS Foundation Trust,1223,98.70%,360
RY1,Liverpool Community Health NHS Trust,3695,N/A,0
RBQ,Liverpool Heart And Chest Hospital NHS Foundation Trust,0,N/A,0
REP,Liverpool Women's NHS Foundation Trust,198,N/A,0
RQ6,Royal Liverpool And Broadgreen University Hospitals NHS Trust,2100,94.20%,597
RVY,Southport And Ormskirk Hospital NHS Trust,2379,94.50%,276
RBN,St Helens And Knowsley Hospitals NHS Trust,2362,93.60%,628
RET,The Walton Centre NHS Foundation Trust,0,N/A,0
NNF,City Healthcare Partnership Cic,733,N/A,0
RCD,Harrogate And District NHS Foundation Trust,1316,94.90%,197
RWA,Hull And East Yorkshire Hospitals NHS Trust,2590,95.20%,778
RV9,Humber NHS Foundation Trust,290,N/A,0
RJL,Northern Lincolnshire And Goole NHS Foundation Trust,2860,90.10%,573
RCB,York Teaching Hospital NHS Foundation Trust,3399,96.90%,594
RJF,Burton Hospitals NHS Foundation Trust,2170,93.40%,318
Y02421,Malling Health - Telford Wic,180,N/A,0
RJD,Mid Staffordshire NHS Foundation Trust,940,88.30%,259
RXW,Shrewsbury And Telford Hospital NHS Trust,2339,92.50%,453
R1D,Shropshire Community Health NHS Trust,469,N/A,0
Y02495,Shropshire Walk In Health Centre,515,N/A,0
R1E,Staffordshire And Stoke On Trent Partnership NHS Trust,414,N/A,0
RL1,The Robert Jones And Agnes Hunt Orthopaedic Hospital NHS Foundation Trust,0,N/A,0
RJE,University Hospital Of North Staffordshire NHS Trust,3606,76.90%,870
RFF,Barnsley Hospital NHS Foundation Trust,1592,91.50%,420
NTP08,Care Uk NHS Rotherham Diagnostic Centre,1043,N/A,0
RP5,Doncaster And Bassetlaw Hospitals NHS Foundation Trust,3387,94.70%,580
RCU,Sheffield Children's NHS Foundation Trust,1083,97.60%,123
Y02565,Sheffield City GP Hc (Wic),1309,N/A,0
RHQ,Sheffield Teaching Hospitals NHS Foundation Trust,3048,91.10%,602
RFR,The Rotherham NHS Foundation Trust,1450,98.90%,307
RTK,Ashford And St Peter's Hospitals NHS Foundation Trust,2155,94.90%,417
Y02688,Ashford Health Centre,919,N/A,0
RXH,Brighton And Sussex University Hospitals NHS Trust,3104,86.00%,744
RXC,East Sussex Healthcare NHS Trust,2722,90.90%,517
RDU,Frimley Park Hospital NHS Foundation Trust,2005,92.90%,542
RPC,Queen Victoria Hospital NHS Foundation Trust,253,N/A,0
RA2,Royal Surrey County Hospital NHS Foundation Trust,1431,96.90%,349
RTP,Surrey And Sussex Healthcare NHS Trust,1678,97.00%,522
RDR,Sussex Community NHS Trust,1343,N/A,0
RYR,Western Sussex Hospitals NHS Foundation Trust,2608,95.90%,701
RWX,Berkshire Healthcare NHS Foundation Trust,1332,N/A,0
RXQ,Buckinghamshire Healthcare NHS Trust,2372,90.10%,447
RD7,Heatherwood And Wexham Park Hospitals NHS Foundation Trust,2402,85.90%,659
RNU,Oxford Health NHS Foundation Trust,596,N/A,0
RTH,Oxford University Hospitals NHS Trust,2668,88.30%,633
NVC03,Reading NHS Treatment Centre,729,N/A,0
RHW,Royal Berkshire NHS Foundation Trust,2214,86.40%,569
RBD,Dorset County Hospital NHS Foundation Trust,719,96.80%,241
RDY,Dorset Healthcare University NHS Foundation Trust,758,N/A,0
RN5,Hampshire Hospitals NHS Foundation Trust,2163,95.30%,399
R1F,Isle Of Wight NHS Trust,1247,95.30%,139
RD3,Poole Hospital NHS Foundation Trust,1238,95.20%,362
RHU,Portsmouth Hospitals NHS Trust,2551,83.10%,647
R1C,Solent NHS Trust,339,N/A,0
RW1,Southern Health NHS Foundation Trust,445,N/A,0
NTPAD,St Mary's NHS Treatment Centre,857,N/A,0
RDZ,The Royal Bournemouth And Christchurch Hospitals NHS Foundation Trust,1644,93.80%,390
RHM,University Hospital Southampton NHS Foundation Trust,3152,84.30%,436
RCF,Airedale NHS Foundation Trust,1062,93.70%,250
RAE,Bradford Teaching Hospitals NHS Foundation Trust,2535,94.20%,633
RWY,Calderdale And Huddersfield NHS Foundation Trust,2744,96.10%,577
Y01231,Lcd-Leeds-Ooh,607,N/A,0
RR8,Leeds Teaching Hospitals NHS Trust,4469,96.00%,"1,438"
Y01069,Local Care Direct Ooh,634,N/A,0
RXF,Mid Yorkshire Hospitals NHS Trust,4436,99.20%,970
RXG,South West Yorkshire Partnership NHS Foundation Trust,0,N/A,0